{
  "mutation_id": "M012_INSPECTION_LIMIT_CONFLICT",
  "description": "检验记录允许最大1个可见颗粒，与控制计划和SOP的零容忍规格冲突。",
  "operations": [
    {"op": "set", "document_id": "IR-AXLE-SYN", "path": "fields.characteristics", "value": [{"process_step_id": "WELD-10", "characteristic_id": "CTQ-NUT-SEAT-SPATTER", "specification": {"target": 0, "minimum": 0, "maximum": 1, "unit": "visible_particle"}, "locator": "InspectionRecord!H9:L9"}]}
  ],
  "expected_rule_statuses": {
    "QCI-R001": "PASS",
    "QCI-R002": "CONTRADICTED",
    "QCI-R003": "PASS",
    "QCI-R004": "PASS",
    "QCI-R005": "PASS",
    "QCI-R006": "PASS",
    "QCI-R007": "PASS"
  }
}
