{
  "mutation_id": "M011_SOP_UNIT_CONFLICT",
  "description": "SOP对同一特性使用不同单位，形成可定位的跨文档规格冲突。",
  "operations": [
    {"op": "set", "document_id": "SOP-AXLE-SYN", "path": "fields.characteristics", "value": [{"process_step_id": "WELD-10", "characteristic_id": "CTQ-NUT-SEAT-SPATTER", "specification": {"target": 0, "minimum": 0, "maximum": 0, "unit": "particle_per_cm2"}, "locator": "SOP#page-4.step-7"}]}
  ],
  "expected_rule_statuses": {
    "QCI-R001": "PASS",
    "QCI-R002": "CONTRADICTED",
    "QCI-R003": "PASS",
    "QCI-R004": "PASS",
    "QCI-R005": "PASS",
    "QCI-R006": "PASS",
    "QCI-R007": "PASS"
  }
}
